Title,Year Released,Media Type,Movie Duration,Audience Rating,Audience Vote Count,Metacritic Score,Plot Description
1174. Don,1978,MOVIE,2h 46m,7.7,13K,NA,"Don, a wanted criminal, dies in a police chase. DSP D'Silva is the only one who knows about his death, and to get hold of the gang he trains Don-lookalike Vijay. But Vijay faces danger from the police and from within the gang."
1175. Dabangg 3,2019,MOVIE,2h 40m,3.0,20K,NA,"Chulbul Pandey encounters an enemy from his past, and his origin story as the fearless cop unfolds."
1176. 14 Phere,2021,MOVIE,1h 51m,6.3,5.3K,NA,"Sanjay, a Rajput from Jahanabad, is in love with Aditi, a Jat from Jaipur. They want to get married, but don't want to hurt their families. So they plan to get married by arranging a fake set of parents. Will they succeed?"
1177. Gangaa Jamunaa Saraswathi,1988,MOVIE,3h 7m,4.7,722,NA,"Gangaa Jamunaa and Saraswathi the most pious rivers, create a unique holy merger, popularly known as ""Sangam"". Likewise the characters of our story Gangaa Jamunaa and Saraswathi desire to meet and merge in love of each other. Gangaa Jamunaa begin to love each other and pledge to become one, Saraswati silently loves Gangaa, and dedicates her life to him. However there are many, who would like to separate the happy lovers. There is Hansraj, who does it, and with the result Jamuna separates from Gangaa. Jamuna reaches Shanker's home, Shanker who already loved her becomes extremely happy finding Jamuna in his home. In the meantime Saraswati was about to come closer to Ganga. When Hansraj, who had earlier swindled the property of Ganga's father by illegal means wanted to get rid of the rightful owner Ganga, he got Ganga shot. Ganga was badly wounded and there was no hope of his survival."
1178. Political War,2024,MOVIE,2h 5m,8.5,276,NA,"Set against the backdrop of an election, corrupt politicians stir up religious conflicts."
1179. The X Factor India,2011–,TV SERIES,NA,5.5,19,NA,"A Indian music competition to find new singing talent, contested by aspiring singers drawn from public auditions."
1180. 1971,2007,MOVIE,2h 16m,8.2,2.8K,NA,"Based on true facts, the film revolves around 6 brave soldiers who escape from the clutches of the Pakistan Army and risk death with honour and courage with sacrifice towards their journey home."
1181. Online,2021–,TV SERIES,NA,NA,NA,NA,"Growing up with a father who own a lingerie shop, Chetan's future always remained in shambles. But Chetan has a plan to expand his father's declining business by gaining exposure from Chinese lingerie market. Will Chetan be able to convince his stern father to send him all the way to China?"
1182. Puncch Beat,2018–,TV SERIES,NA,6.3,4.7K,NA,"Things change when there is a murder of a student in the school and everyone becomes a suspect. And during the investigation, so many secrets will be revealed that might break or make friends and relationships."
1183. Aurat,2019–,TV SERIES,NA,NA,NA,NA,Aurat is story of indian housewife from indian village taking revenge from her husband.
1184. Khiladi 786,2012,MOVIE,2h 21m,4.3,7.9K,NA,"A father who runs a marriage bureau believes that his son is a failure in life. In order to prove him wrong, his son takes on the task of finding a match for a gangster's sister."
1185. Family Aaj Kal,2024–,TV SERIES,NA,6.5,207,NA,"The Kashyaps' like to believe that they are an open-minded lot that respects everybody's work, but their own daughter's choices make them question- is no work really too small?"
1186. Dil Ka Rishta,2003,MOVIE,2h 30m,4.9,1.9K,NA,"A man faces a dilemma after he accidentally kills his lover's fiancee and hides this secret from her, not knowing that it may create a rift in their lives."
1187. Tooth Pari: When Love Bites,2023–,TV SERIES,NA,6.9,3.2K,NA,A rebellious vampire with a broken tooth falls for a shy dentist on the streets of Kolkata but will human and mystical forces keep them apart?
1188. Satyameva Jayate,2018,MOVIE,2h 20m,5.7,7.9K,NA,An honest cop attempts to hunt down a vigilante who kills corrupt cops by setting them on fire.
1189. Goliyon Ki Raasleela Ram Leela,2013,MOVIE,2h 30m,6.4,22K,NA,"Modern adaptation of William Shakespeare's 'Romeo and Juliet' with an Indian twist, the film focuses on the story of Ram and Leela, their love, lust and the drama afterwards."
1190. Kumkum Bhagya,2014–2024,TV SERIES,NA,3.1,1.8K,NA,Kumkum Bhagya is a love story of Pragya and Abhi who are destined to be together against all odds.
1191. City of Dreams,2019–,TV SERIES,NA,7.7,3.9K,NA,"Following the death of Ashish, the promised heir to the Gaikwad political legacy, it is Ameya Rao Gaikwad's rebel daughter Poornima who's at the helm of affairs as the interim chief minister of Maharashtra."
1192. Hello Myself Lilly,2020–,TV SERIES,NA,6.5,7,NA,"Lilly has her own beauty products and is looking forward to her brand being recognized in the market as it promises to make you fair. She reaches out to people by calling them but isn't successful in selling any, she even tries to get someone to try and buy. She gets very depressed but her cheerful Fiancée encourages her teaching her that it's all about how she speaks to them and then soon Lily discovers that she has to use a seductive voice and get people to buy her products. The couple experimented on it while making Love to each other and got her first Sale."
1193. What the Folks,2017–2022,TV SERIES,NA,8.3,2.9K,NA,"'What The Folks' is a journey of how modern families are breaking stereotypes, overcoming generation gaps, and growing to love one another, despite having starkly different world views."
1194. Devil Girl,2020–2021,TV SERIES,NA,NA,NA,NA,"Rekha Mona Sarkar debut as a director in series DEVIL GIRL, her first project is Indian adaptation of famous Japanese Comedy- The Succulent succubus .DEVIL GIRL ,Episode 1, A fun-filled parody of the film Bedazzled. Suhana Khan , shakexpearking, Ayesha Pathan, Sana Sundi."
1195. Berlin,2023,MOVIE,2h 4m,8.4,43,NA,"New Delhi, 1993, a deaf-mute young man is accused and arrested by the Bureau for being a spy. A sign language expert is brought as an interpreter. As the mystery unfolds, the line between guilt and innocence blurs."
1196. Ek Mahanayak - Dr B R Ambedkar,2019–,TV SERIES,NA,7.4,954,NA,"Ek Mahanayak is the story of Dr. Bhimrao Ambedkar, the founding father of the Constitution of India. For the first time, the story of Babasaheb will be shown on television through serial. The show will include inspiring parts of Babasaheb's life. The story of this show will begin from the childhood of Babasaheb. In which Bhimrao Ambedkar's role will be seen playing child artist Aayudh Bhanushali. Later Prasad Jawade will be seen in the role of young Baba Saheb."
1197. The Power,2021,MOVIE,2h 33m,5.4,2.2K,NA,"It is a hair-raising journey into the world of two lovers as both their families are ripped apart for the sake of revenge and power, and an entertaining look at how they rise out of that pit of blood lust and despair, together."
1198. No Problem,2010,MOVIE,2h 19m,4.5,3K,NA,"Bank robbers, diamond thieves, a minister's homicide, and a hyper wife are just some of the challenges faced by a bumbling senior police officer."
1199. Jersey,2022,MOVIE,2h 50m,7.3,15K,NA,A cricketer who quits cricket decides to revive his career at the age of 36 for his sons dream and prove his ability.
1200. Laxmii,2020,MOVIE,2h 21m,2.5,59K,NA,"Aasif visits his wife's parents' house and happens to go to a ground that is supposedly haunted. However, he is soon possessed by the spirit of a transgender who is out for revenge."
1201. Ssshhhh... Koi Hai,2001–2004,TV SERIES,NA,7.5,880,NA,A non hosted horror anthology series.
1202. Bellbottom,2021,MOVIE,2h 3m,6.1,24K,NA,"When an Indian commercial airliner is hijacked by terrorists in the mid 1980s, a government agent is tasked with rescuing the 210 hostages."
1203. Fear Factor: Khatron Ke Khiladi,2008–,TV SERIES,NA,5.9,482,NA,Indian version of Fear Factor.
1204. Satyavati,2016,MOVIE,2h,7.0,252,NA,"""When you are shunned and looked down upon for non-conformance, there is nowhere to go. When your protector has become the threat, there is nowhere to go.When the crime gets legitimized in the garb of tradition, there is nowhere to go"" Satyavati- and we call this love is a story that takes place in today's times where tenderness & innocence come under attack and all that remain is a scar. And nowhere to go."
1205. Zindagi inShort,2020,TV SERIES,NA,7.1,780,NA,"An anthology of 7 heart-warming stories, Zindagi inShort glimpses into various moments of ordinary lives. The circumstances that we live in, we ignore our loved ones, we madly focus on our careers, we stop thinking about them."
1206. Faasla,2020,TV SERIES,NA,NA,NA,NA,"Gunjan, a vivacious housewife, loves to spontaneously seduce her husband, Sameer. After Sameer's injury, Gunjan's attraction to the neighbor, Yogi, leads to an affair."
1207. Geraftaar,1985,MOVIE,2h 47m,5.9,526,NA,"Kishan Kumar Khanna is a well-rate film actor who falls head over heels in love with young, beautiful and attractive Anuradha Saxena much to the dislikeness of her gangster brother who wastes no time in entrapping Kishan in a web of lies and deceits and gets him imprisoned for life. While in jail, Kishan reaches up with his long lost elder brother Karan who has been sentenced for life charged with murdering the Police Commissioner son, Vijay Sinha. Together they both plotted a scheme which will only benefit them in granting revenge from there perpetrators."
1208. Sabak Ishq Ka,2023–,TV SERIES,NA,NA,NA,NA,"Shikha, who teaches in an average coaching class, starts getting perplexed as a new student, Mayank starts having feelings for her. The problem arises when even Shikha starts reciprocating the same feelings for Mayank."
1209. Badmaash Company,2010,MOVIE,2h 22m,6.1,7.9K,NA,Four youngsters grow rich together with a big idea in 90's middle-class Bombay. All is hunky dory till they are forced to shut shop until a plan comes up.
1210. Lal Salaam,2024,MOVIE,2h 30m,4.7,1.1K,NA,"A reckless townsman tries to mend his thug ways ends up resurrecting himself and proves to be worthy of the world, in the eyes of the same people who chased him away."
1211. Shemale,2019–,TV SERIES,NA,6.5,14,NA,A man who longs to feel like a woman becomes one and his fiancee looks for a way to make him a man again.
1212. Love on Rent- Nuefliks,2020,TV SERIES,NA,NA,NA,NA,NA
1213. Roar: Tigers of the Sundarbans,2014,MOVIE,2h 3m,5.6,810,NA,"After his photojournalist brother gets killed by a white tigress in the jungles of the Sundarbans, Pandit and his team of commandos enter the prohibited core area of the forest to avenge his death."
1214. Mera Gaon Mera Desh,1971,MOVIE,2h 31m,7.1,389,NA,"When Ajit, a former prisoner, learns of Jabbar who is terrorising the people of his village, he decides to stand up against him. However, things take a turn when Jabbar abducts Ajit's lover."
1215. Tipppsy,2024,MOVIE,1h 55m,8.2,27,NA,"Things go wrong for a group of girl friends who go to Goa, for a bachelorette party."
1216. The Fable,2024,MOVIE,1h 59m,6.9,169,NA,"Dev owns orchards and lives on a sprawling estate. After finding burnt trees Dev monitors workers and Nomads fall under suspicion. Despite night guards, a huge fire engulfs the mountainside. Dev uses violence in his search."
1217. Sasural Simar Ka 2,2021–2023,TV SERIES,NA,4.4,291,NA,"Gitanjali Devi entrusts Simar Bhardwaj with the task of finding an ideal bride for her grandson. Simar's quest ends when she meets her namesake, Simar Narayan, who dreams of making it big as a singer."
1218. Paltan,2018,MOVIE,2h 30m,5.2,1.2K,NA,An action-war drama based on the 1967 Nathu La and Cho La clashes along the Sikkim border after 1962 Sino-Indian War.
1219. Muskaan,2018–2020,TV SERIES,NA,7.3,39,NA,The story is about the struggle of a sex worker and her daughter named Muskaan[1] who faces social ostracism because of her mother's profession.
1220. Molkki,2020–2022,TV SERIES,NA,4.7,297,NA,"A victim of bride buying, a social evil prevalent in India's heartland, Purvi is married off to Virender, who is double her age and a widower with children from his first wife."
1221. Bhabhi,2002–2008,TV SERIES,NA,5.9,34,NA,"The story of Saroj, a bride who finds her life changing drastically the minute she lifts her bridal veil."
1222. Ram Lakhan,1989,MOVIE,2h 54m,6.7,3K,NA,"Ram Lakhan is the story of two brothers who part ways due to their ideological differences, but how they come to each other's rescue as the story unfolds."
1223. Pati Patni Aur Woh,2019,MOVIE,2h 6m,5.8,8.4K,NA,"Chintu Tyagi is an ordinary, middle class man who finds himself torn between his wife and another woman."
1224. The Aam Aadmi Family,2016–,TV SERIES,NA,8.4,2.3K,NA,"This show revolves around a middle-class Sharma family. There's a gossip-loving grandmother, a hardworking father, a sanskaari mom, and two grown up kids who are dealing with their middle-classness in the best way possible."
1225. Maine Pyar Kiya,1989,MOVIE,3h 12m,7.3,13K,NA,"After Suman's father leaves her in the care of another family while he travels abroad, she falls in love with Prem. However, in order to for them to marry, Prem has to prove to Suman's father that he is not the same as his own dad."
1226. Deewana,1992,MOVIE,3h 5m,6.7,7.5K,NA,"A singer (Rishi Kapoor) marries his biggest fan, but his uncle (Amrish Puri) plans to kill him in order to gain his money."
1227. Bloody Brothers,2022–,TV SERIES,NA,6.2,731,NA,"Driving home late one night, two brothers, Jaggi and Daljeet run over an old man. They put the body back in his house, but when people suspect, the brothers' lives fall apart. They realise they can trust no one. Not even each other."
1228. Barsatein - Mausam Pyaar Ka,2023–2024,TV SERIES,NA,6.3,594,NA,"A sensible and ambitious journalist joins a media company run by a maverick. While united in their passion for honest journalism, their contrasting characters immediately puts them at loggerheads."
1229. Aiyyaa,2012,MOVIE,2h 32m,4.4,2.1K,NA,"A woman goes on the hunt for her dream man, armed with her wild imagination, her passion for Masala-films, and her ultra-sensitive sense of smell."
1230. Down Underdogs,2022,TV SERIES,NA,9.0,452,NA,Cricketers and sports experts analyse India's victory over Australia during the 2020-21 Border-Gavaskar Trophy.
1231. Batla House,2019,MOVIE,2h 26m,7.2,13K,NA,"In 2008, a violent shootout with terror suspects leaves one police officer struggling to hunt down the fugitives and justify the police action."
1232. Candy,2021–,TV SERIES,NA,8.1,15K,NA,"In misty Rudrakund, the brutal murder of a school student pushes troubled teacher Jayant Parekh and cop Ratna Sankhawar to unravel a web of sinister secrets involving rave parties, cold cases, a demon in the woods and a hallucinogen, Candy"
1233. Angoor,1982,MOVIE,2h 11m,8.3,5.9K,NA,"Based on Shakespeare's 'A Comedy of Errors', this is a story of identical twins (2 pairs) and mistaken identities."
1234. Policegiri,2013,MOVIE,2h 21m,4.2,1.6K,NA,DCP Rudra faces a bunch of challenges after he locks horns with a notorious criminal Nagori Subramanium.
1235. May I Come In,2023–,TV SERIES,NA,NA,NA,NA,NA
1236. Aag Ke Sholay,1988,MOVIE,2h 18m,4.6,11,NA,NA
1237. Ek Thi Daayan,2013,MOVIE,2h 15m,5.7,4.6K,NA,"When gifted magician Bobo finds himself assailed by hallucinations and seeks professional help, he learns he's being haunted by a sinister spirit."
1238. Harami,2020,MOVIE,1h 40m,7.4,1.1K,NA,"An orphan teenage pickpocket working in the trains of Mumbai along with his gang, embarks on a life-altering journey when faced by the daughter of one of his victims who's committed suicide after being robbed."
1239. Hazaaron Khwaishein Aisi,2003,MOVIE,2h,7.9,5.3K,NA,"Set in the backdrop of Indian Emergency 1975, the story revolves around 3 friends whose lives changes drastically after the turn of events."
1240. Blind,2023,MOVIE,2h 4m,4.0,6.2K,NA,"When a twist of fate leaves Gia blind, she must summon every ounce of courage to rebuild her life. But when she becomes the sole witness to a heinous crime, she unwittingly enters a deadly game of cat and mouse with a dangerous criminal."
1241. Great Grand Masti,2016,MOVIE,2h 14m,3.7,3.1K,NA,"Amar, Meet and Prem go into a small town where they encounter a 'femme fatale' in the form of Ragini. Ragini is everything they had dreamed of, but she slowly turns into their worst nightmare!"
1242. Heyy Babyy,2007,MOVIE,2h 24m,6.1,16K,NA,Three bachelors who are compulsive womanizers find their lives turned upside down when a baby is left at their doorstep. The trio suspect each other of being the father.
1243. Kites,2010,MOVIE,2h 3m,6.0,14K,62,"A wounded man searches for his sweetheart in the Mexican desert while on the run from the police, bounty hunters, and others."
1244. Monsoon Shootout,2013,MOVIE,1h 32m,6.6,1.5K,NA,"As heavy rains lash Mumbai, a cop on his first assignment faces a life altering decision when he must decide whether to shoot a suspect or not."
1245. Paramavatar Shri Krishna,2017–2020,TV SERIES,NA,5.6,75,NA,Reminisce the naughtiness and enchanting ways of Krishna.
1246. Jassi King - The FAKR,2020–,TV SERIES,NA,8.6,7,NA,The plot revolves around the musician Jassi King. Romance enters into his music-filled life and girls have been strong fans of his talents. Things take a twist when a new girl enters the life of Jassi King.
1247. Pyaar Tune Kya Kiya,2014–,TV SERIES,NA,7.4,92,NA,This drama is generally based on different love story around india that goes through 8 seasons have been aired yet
1248. Daku Ramkali,2000,MOVIE,2h 14m,6.0,29,NA,"Sher Singh and Arjun Singh are identical twin brothers. Arjun is an honest police officer but Sher Singh becomes a dacoit under the influence of Bajrang and his gang. Sher Singh's daughter Champa and Arjun Singh's daughter Raamkali are also twins. Bajrang's goon Dhanraj kills Arjun Singh, and he falsely blames on Sher Singh. Sher Singh becomes imprisoned and escapes from jail. Although he tries to kill Dhanraj but Dhanraj kills him. In the meantime Champa falls in love with Dhanraj's son Shankar who is a police also. Raamkali want to take revenge her father Arjun's death and turget Dhanraj.[5]"
1249. Maal Paani Sexy Sauda,2022–,TV SERIES,NA,7.8,9,NA,NA
1250. Talaash: The Hunt Begins...,2003,MOVIE,2h 33m,4.3,1.6K,NA,-The Hunt Begins- For them it was revenge. For him it was a challenge. A timeless ride on a ferocious mission.
1251. Jism,2003,MOVIE,2h 16m,5.3,2.3K,NA,When an unemployed man falls for a wealthy woman and he is willing to do whatever he must to get her away from her abusive husband.
1252. Rehnaa Hai Terre Dil Mein,2001,MOVIE,2h 40m,7.5,9.2K,NA,"Maddy impersonates Rajeev, the person his love interest, Reena, is about to marry and attempts to woo her. However, he is unprepared for the moment when the truth will be revealed."
1253. Mumbai Saga,2021,MOVIE,2h 15m,5.8,9.9K,NA,The plot of the movie is set in the era of the 80s and 90s which were marked as a transformed period of Mumbai.
1254. Murder in Agonda,2022–,TV SERIES,NA,6.0,284,NA,"Sub Inspector Sanket Salelkar investigates his first murder case involving Mala Coutinho, found dead in her 200-year-old Portuguese villa. Seeming straightforward, his sister Sarla brings unexpected news."
1255. Sapna Babul Ka.... Bidaai,2007–2010,TV SERIES,NA,5.1,271,NA,The trials and tribulations of sisters Ragini and Sadhna. Ragini and Sadhna are different in terms of beauty.
1256. Tharki Chotu,2020–,TV SERIES,NA,5.4,5,NA,NA
1257. Rock On!!,2008,MOVIE,2h 25m,7.7,23K,NA,Four friends reunite to relive their moments of glory as a rock band.
1258. Dr. Cabbie,2014,MOVIE,1h 41m,6.0,3.9K,NA,"An Indian doctor emigrates to Canada in the hope of starting a new life, but bureaucracy confines him to life as a taxi driver. When he cannot suppress his desire to practice medicine, he begins illegally treating patients from his cab."
1259. Rasmalai,2021–,TV SERIES,NA,NA,NA,NA,The Story of office Politics with the flavor of Love and Romance. Girl falls in the Trap of Game play of Boss. But who is the Main conspirator behind all this.
1260. Malhar,2024,MOVIE,1h 43m,6.9,11,NA,"In a remote Kutch village, three interconnected stories unfold. Two friends battle to repair a hearing aid. Jasmine and Jatin, from different faiths, face obstacles in their love. Newly-wed Kesar endures pressure to conceive from her law."
1261. Sanki Painter,2023–,TV SERIES,NA,NA,NA,NA,NA
1262. Yodha,1991,MOVIE,2h 22m,4.5,274,NA,Karan a respected lawyer has many enemies including Suraj due to his honesty.Justice Agnihotri is Karan's idol but conducts his illegal activities by name of Daga.Daga takes advantage of Karan and Suraj's rivalry making them sore enemies.
1263. Anju or Manju,2024–,TV SERIES,NA,NA,NA,NA,"A caring father is worried about own daughter, who left alone after goes at marriage function of relatives. One Day his family friend ready for help them. After some day his servant found something, who full filled his dream. So guys watch this full series for know everything."
1264. Code Name: Tiranga,2022,MOVIE,2h 17m,3.3,3K,NA,The story of a spy on an unfaltering and fearless mission for her nation in a race against time where sacrifice is her only choice.
1265. Best of Luck Nikki,2011–2016,TV SERIES,NA,8.5,1.8K,NA,Dolly creates a video diary about their family and friends containing advice for Nikki when she grows up.
1266. Garmi,2022–,TV SERIES,NA,7.6,7,NA,NA
1267. Hate Story,2012,MOVIE,2h 20m,5.3,4K,NA,"After a powerful businessman has her baby forcefully aborted, Kaavya Krishna uses her body as a sexual weapon to destroy his empire, brick by brick."
1268. Nasha,2013,MOVIE,2h 2m,3.2,1.4K,NA,"A teenage boy becomes smitten with his new drama teacher and pursues her, despite the perilous risks of being found out."
1269. Mausam,2011,MOVIE,2h 41m,4.8,5.7K,NA,"A war, religious conflicts, and misunderstandings create obstacles for a couple of different faiths."
1270. D-Day,2013,MOVIE,2h 33m,7.2,10K,NA,A team of experts dispatched to bring in The Most Wanted Man in India almost achieve the unthinkable ... until something goes horribly wrong.
1271. Kaal,2005,MOVIE,2h 6m,4.7,6K,NA,"A tiger expert, his wife, two tourists and a village chief engage in a battle for survival against supernatural beasts within Jim Corbett National Wildlife Park."
1272. My Big Fat Bride,2015,MOVIE,1h 49m,7.5,21K,NA,Prem and his oversized wife Sandhya are supposed to spend a lifetime together. Will a regular arranged marriage turn out to be a perfect mismatch?
1273. The Bride of Badrinath,2017,MOVIE,2h 19m,6.1,14K,NA,Badrinath is looking for a typical bride; Vaidehi is looking for an independent life. Together they must break with tradition and redefine their role.
1274. 1942: A Love Story,1994,MOVIE,2h 37m,7.2,3.7K,NA,"A young Indian couple, both from wealthy backgrounds, find themselves caught up in the 1940's Indian revolutionary movement against their families whom are under the thumb a sadistic British general."
1275. Golmaal Returns,2008,MOVIE,2h 15m,5.2,9.2K,NA,"A man is sandwiched between his over possessive wife and a police inspector, where he is suspected for adultery and murder."
1276. Aatma,2023–,TV SERIES,NA,NA,NA,NA,NA
1277. SK Sir Ki Class,2023–,TV SERIES,NA,8.2,7.5K,NA,NA
1278. Na Tum Jaano Na Hum,2002,MOVIE,2h 38m,4.9,3.1K,NA,A romantically inclined couple decide to get to know each other through letters without disclosing their identities.
1279. 15th August,1993,MOVIE,2h 48m,5.7,29,NA,A man kills a military officer. The officer's brother vows to destroy the killer.
1280. Behen Hogi Teri,2017,MOVIE,2h 8m,5.6,2.4K,NA,A jobless youngster has to fight with criminal rivals who come to snatch away his neighborhood lady love as a bride and also his family which seems not to take note of his feelings towards the girl next door.
1281. Mr. & Mrs. Khiladi,1997,MOVIE,2h 13m,6.3,6.7K,NA,A slacker (Akshay Kumar) must impress a wealthy man to marry her daughter (Juhi Chawla).
1282. Rang,1993,MOVIE,2h 30m,4.7,278,NA,"Although Suchitra has been marry to Madhav Singh for years she has always been conscious about maintaining a slim figure which in her believe will make her look young. She watched helplessly as her only daughter, Indu get married without her consent to Ajay Malhotra while both are proud parents to two daughters, Pooja and Kaajal. Suchitra and Indu manage a business but there methods of exploiting workers are unacceptable to Ajay who decides to leave the house with Pooja. Years later Ajay return and is now elected as the managing director of the business only to invite the wrath of his mother-in-law and estranged wife. While Kaajal have matured and is in love with her fellow collegian, Yogi Joshi - unknown to her that Pooja also have feelings for Yogi - it is this love triangle that will bring the two sisters face to face with their parents changing lives forever."
1283. Rangrasiya,2013–2014,TV SERIES,NA,6.9,938,NA,Rangrasiya tells us the story of a village girl from a rural village in Rajasthan and an BSD officer...who are met at an encounter by BSD army.
1284. Shagird,2011,MOVIE,2h 23m,7.0,2.3K,NA,"A rookie cop questions the tactics of his superior, and attempts to track the abductors of his girlfriend."
1285. Raju Ban Gaya Gentleman,1992,MOVIE,2h 32m,6.7,8.4K,NA,"Raju comes to Bombay chasing his dreams, but keeps losing out on opportunities. His love, Renu helps him find a job. Success goes to his head until one day a tragic accident destroys his reputation."
1286. Dil Aashna Hai (...The Heart Knows),1992,MOVIE,2h 44m,4.9,1.8K,NA,"Laila, brought up in a brothel, is a cabaret dancer in Digvijay Singh's five star hotel. One day, her dying mother informs her that she is adopted. Laila is aided by Karan in her search for the mother."
