Title,Year Released,Media Type,Movie Duration,Audience Rating,Audience Vote Count,Metacritic Score,Plot Description
1. Kalki 2898 AD,2024,MOVIE,3h,7.7,38K,65,"A modern-day avatar of Vishnu, a Hindu god, who is believed to have descended to earth to protect the world from evil forces."
2. Mirzapur,2018–,TV SERIES,NA,8.5,86K,NA,A shocking incident at a wedding procession ignites a series of events entangling the lives of two families in the lawless city of Mirzapur.
3. Kill,2023,MOVIE,1h 45m,8.0,5.6K,74,"During a train trip to New Delhi, a pair of commandos face an army of invading bandits."
4. Wild Wild Punjab,2024,MOVIE,1h 49m,6.6,11K,NA,"Khanna has had a breakup. He's upset, but he has friends like Arora, Jain and Honey paa'ji who encourage him to face this breakup head-on and move on. They embark on a trip across Punjab to help Khanna find the closure he desires."
5. Srikanth,2024,MOVIE,2h 14m,7.5,9.2K,NA,"Blind Srikanth gets into MIT, founds Bollant Industries. Pursues goals for visually impaired while facing entrepreneurial challenges, navigating personal sacrifices. Highlights obstacles overcome by the blind in academics and business."
6. Indian 2,2024,MOVIE,3h,6.1,12K,NA,"Senapathy, an ex-freedom fighter turned vigilante who fights against corruption. Senapathy returns to the country to aid a young man who has been exposing corrupt politicians in the country through videos on the internet."
7. Maharaj,2024,MOVIE,2h 11m,6.5,9.2K,NA,"Based on a real-life historic court case, a bold journalist questions a revered leader's immoral behavior."
8. 12th Fail,2023,MOVIE,2h 27m,8.9,122K,NA,The real-life story of IPS Officer Manoj Kumar Sharma and IRS Officer Shraddha Joshi.
9. Animal,2023,MOVIE,3h 24m,6.2,95K,33,The hardened son of a powerful industrialist returns home after years abroad and vows to take bloody revenge on those threatening his father's life.
10. Laapataa Ladies,2023,MOVIE,2h 2m,8.5,36K,NA,"The misadventures of two young brides who get lost from the same train. From mistaken identities to laugh-out-aloud escapades, the ensuing chaos guarantees laughter galore and heartwarming moments."
11. Chandu Champion,2024,MOVIE,2h 22m,8.3,24K,NA,A man who faced one adversary after another with an undying spirit. His unwavering zeal and never give up attitude led to India's first individual gold medal in any form of the Olympics.
12. Sarfira,2024,MOVIE,2h 35m,8.9,6.1K,NA,"A man fights to make his dream of creating a low cost airline a reality, facing opposition from devious competitive airline owners who threaten his business and his passengers' safety."
13. Panchayat,2020–,TV SERIES,NA,9.0,95K,NA,"A comedy-drama, which captures the journey of an engineering graduate Abhishek, who for lack of a better job option joins as secretary of a Panchayat office in a remote village of Uttar Pradesh."
14. Maidaan,2024,MOVIE,3h 1m,8.0,19K,NA,"Inspired by the Indian national football team coach and manager Syed Abdul Rahim, who is regarded as the architect of Indian football."
15. RRR,2022,MOVIE,3h 7m,7.8,169K,83,A fearless warrior on a perilous mission comes face to face with a steely cop serving British forces in this epic saga set in pre-independent India.
16. Sipahi,2024,MOVIE,1h 2m,8.4,14K,NA,"Agent Korkut Ali Türkoglu, trained by the National Intelligence Organization, uncovers crucial information about plans concerning Turkey."
17. Murder in Mahim,2024–,TV SERIES,NA,8.0,38K,NA,"Set against the backdrop of a horrible murder at Mahim station, follows Peter's involvement in this diabolical inquiry. The stakes rise when his own son, Sunil, becomes a suspect in the case."
18. Kakuda,2024,MOVIE,1h 56m,5.7,5K,NA,"This horror-comedy film follows a town trapped in time by a curse and 3 of its inhabitants face a ghost that makes them question superstition, tradition and love."
19. Pixels,2015,MOVIE,1h 45m,5.6,161K,27,"When aliens misinterpret video feeds of classic arcade games as a declaration of war, they attack the Earth in the form of the video games."
20. Kota Factory,2019–2021,TV SERIES,NA,9.0,84K,NA,"In a city of coaching centers known to train India’s finest collegiate minds, an earnest but unexceptional student and his friends navigate campus life."
21. Extraction,2020,MOVIE,1h 56m,6.8,267K,56,"Tyler Rake, a fearless black market mercenary, embarks on the most deadly extraction of his career when he's enlisted to rescue the kidnapped son of an imprisoned international crime lord."
22. Sapne Vs Everyone,2023–,TV SERIES,NA,9.4,68K,NA,"Two obsessive dreamers collide with the resistance of expectations, morality and each other."
23. The Goat Life,2024,MOVIE,2h 53m,8.6,7.3K,NA,"The real-life incident of an Indian migrant worker, Najeeb Muhammad, who goes to Saudi Arabia to earn money. However, in a twist of fate, he finds himself living a slave-like existence, herding goats in the middle of the desert."
24. Slumdog Millionaire,2008,MOVIE,2h,8.0,881K,84,"A teenager from the slums of Mumbai becomes a contestant on the show 'Kaun Banega Crorepati?' When interrogated under suspicion of cheating, he revisits his past, revealing how he had all the answers."
25. Shaitaan,2024,MOVIE,2h 12m,6.6,48K,NA,"A family's getaway turns terrifying when an intruder possesses the teen daughter's body, putting her at the mercy of his increasingly sinister commands."
26. Pill,2024–,TV SERIES,NA,8.5,2.7K,NA,"Whistle blowers expose a corrupt nexus of pharma giants, middlemen, and doctors responsible for unethical drug proliferation in India. Can they overcome the powerful opposition?"
27. Babuji,2023,TV SERIES,NA,6.8,212,NA,The plot revolves around the middle aged man who is also the father-in-law. New set of feelings unfolds and unexpected romance happens.
28. Fighter,2024,MOVIE,2h 46m,6.2,47K,63,A reckless yet brilliant squadron leader and his team of elite fighter pilots face mortal dangers and inner demons as they unite for a deadly mission.
29. 36 Days,2024–,TV SERIES,NA,5.0,168,NA,"Led by an ensemble cast, '36 Days' is a crime thriller which takes you through a twisted maze of lies, deceit, love and intrigue. Relationships and people are unmasked and exposed, and secrets come tumbling out of the closet."
30. Rautu Ka Raaz,2024,MOVIE,1h 54m,6.4,1.1K,NA,"After the mysterious death of a warden of Sevadham school, it is up to inspector Negi who suffers from PTSD to solve the high-profile investigation which leads him to disturbing facts."
31. Life of Pi,2012,MOVIE,2h 7m,7.9,671K,79,"A young man who survives a disaster at sea is hurtled into an epic journey of adventure and discovery. While cast away, he forms an unexpected connection with another survivor: a fearsome Bengal tiger."
32. Tumbbad,2018,MOVIE,1h 44m,8.2,60K,NA,A mythological story about a goddess who created the entire universe. The plot revolves around the consequences when humans build a temple for her first-born.
33. Lion,2016,MOVIE,1h 58m,8.0,253K,69,"A five-year-old Indian boy is adopted by an Australian couple after getting lost hundreds of kilometers from home. 25 years later, he sets out to find his lost family."
34. 3 Idiots,2009,MOVIE,2h 50m,8.4,439K,67,"Two friends are searching for their long lost companion. They revisit their college days and recall the memories of their friend who inspired them to think differently, even as the rest of the world called them ""idiots""."
35. Commander Karan Saxena,2024–,TV SERIES,NA,8.2,1.3K,NA,A RAW agent Commander Karan Saxena who has to unravel a high-stakes mystery which includes a political angle and will show betrayal.
36. Heeramandi: The Diamond Bazaar,2024–,TV SERIES,NA,6.4,27K,NA,Sanjay Leela Bhansali brings his majestic signature flair to stories of love and betrayal in the lives of courtesans in pre-independence India.
37. Dangal,2016,MOVIE,2h 41m,8.3,214K,NA,Former wrestler Mahavir Singh Phogat and his two wrestler daughters struggle towards glory at the Commonwealth Games in the face of societal oppression.
38. Aspirants,2021–,TV SERIES,NA,9.2,313K,NA,It is the story of the journey of three UPSC (public service competitive exams in India) aspirants and their friendship against all odds.
39. Dunki,2023,MOVIE,2h 40m,6.6,76K,NA,"When his friends in Punjab struggle to clear the immigration process, an ex-soldier guides them on a risky journey to enter the UK without permission."
40. Madgaon Express,2024,MOVIE,2h 23m,7.1,36K,NA,The journey of three childhood friends who embark on a trip to Goa that goes completely off-track
41. Bad Cop,2024–,TV SERIES,NA,6.4,259,NA,"Karan, a fierce cop trying to chase down Kazbe a villain more powerful and deadly than him while simultaneously managing his personal relationships."
42. Paatal Lok,2020–,TV SERIES,NA,8.1,65K,NA,A down-and-out cop lands the case of a lifetime when four suspects are nabbed in the assassination attempt of a journalist. The pursuit leads him to 'Paatal Lok' and to shocking discoveries in the four suspects' pasts.
43. Teri Baaton Mein Aisa Uljha Jiya,2024,MOVIE,2h 21m,6.3,51K,NA,"Aryan is not able to find a perfect life partner. He meets a perfect girl, Sifra, during an official assignment in the US and falls in love with her only to discover later that it's an impossible love story."
44. Jawan,2023,MOVIE,2h 49m,7.0,98K,NA,A prison warden recruits inmates to commit outrageous crimes that shed light on corruption and injustice - and that lead him to an unexpected reunion.
45. The Family Man,2019–,TV SERIES,NA,8.7,100K,NA,"A working man from the National Investigation Agency tries to protect the nation from terrorism, but he also needs to keep his family safe from his secret job."
46. Bad Newz,2024,MOVIE,2h 22m,NA,NA,NA,"A crazy laugh riot which will show the outcomes of two sophisticated Punjabi men and a Christian-Hindu girl. One of the men has a one night stand with the girl and somehow, craziness happens when she is pregnant unexpectedly."
47. Showtime,2024–,TV SERIES,NA,6.0,745,NA,Features the power struggles and off-camera fights occurring in the backstage areas of Bollywood.
48. Article 370,2024,MOVIE,2h 38m,7.9,21K,NA,"Ahead of a major constitutional decision, special agent Zooni Haksar is tasked with a secret mission to quell violence in a conflict-ridden region."
49. Do Aur Do Pyaar,2024,MOVIE,2h 20m,6.4,6K,NA,"A couple on the brink of a breakup are cheating on each other with two sexy outsiders. Whilst they're waiting to reveal their secret and go their separate ways, life has other plans for them."
50. Bade Miyan Chote Miyan,2024,MOVIE,2h 43m,4.1,38K,NA,Two elite soldiers with troubled pasts are enlisted for a daring mission when a deadly masked villain threatens India's defenses.
51. Sacred Games,2018–2019,TV SERIES,NA,8.5,94K,NA,"A link in their pasts leads an honest cop to a fugitive gang boss, whose cryptic warning spurs the officer on a quest to save Mumbai from cataclysm."
52. Crew,2024,MOVIE,1h 58m,5.9,35K,NA,Follows three hard-working women as their destinies lead to some unwarranted situations and they end up caught in a web of lies.
53. The BFG,2016,MOVIE,1h 57m,6.3,94K,66,"An orphan little girl befriends a benevolent giant who takes her to Giant Country, where they attempt to stop the man-eating giants that are invading the human world."
54. The Darjeeling Limited,2007,MOVIE,1h 31m,7.2,218K,67,"A year after their father's funeral, three brothers travel across India by train in an attempt to bond with each other."
55. Farzi,2023–,TV SERIES,NA,8.4,47K,NA,"An artist who gets pulled into the murky high stakes of a con job and a fiery task force officer on the mission to rid the country of his menaces in a fast-paced, edgy one-of-a-kind thriller."
56. Gullak,2019–,TV SERIES,NA,9.1,24K,NA,"Set in quaint by-lanes in the heart of India, Gullak is a collection of disarming and relatable tales of the Mishra family."
57. Gandhi,1982,MOVIE,3h 11m,8.0,241K,79,The life of the lawyer who became the famed leader of the Indian revolts against the British rule through his philosophy of nonviolent protest.
58. The Devil Inside,2021,TV SERIES,NA,3.7,248,NA,"Smitten by his employee's new bride, a rich boss offers a hefty amount of money to sleep with her."
59. PK,2014,MOVIE,2h 33m,8.1,203K,NA,An alien on Earth loses the only device he can use to communicate with his spaceship. His innocent nature and child-like questions force the country to evaluate the impact of religious views on people.
60. Weapon,2024,MOVIE,2h,8.8,5.2K,NA,"Agni a YouTuber who is a dedicated environmentalist is searching for a superhuman (Mithran), to shoot and add as content for his channel. The journey is full of twists and turns as he is not the only one searching for him."
61. Special OPS,2020–,TV SERIES,NA,8.6,38K,NA,"The story through the eyes of Himmat Singh is based on the inspiration was taken from Nineteen Years of nationally significant events, several espionage missions were undertaken by India in the last two decades."
62. Kaala Paani,2023–,TV SERIES,NA,8.0,10K,NA,"When a mysterious illness descends upon the Andaman and Nicobar Islands, a desperate fight for survival collides with a race to find a cure."
63. The Night Manager,2023–,TV SERIES,NA,7.6,15K,NA,"Follows Shaan Sengupta, an ex-soldier, who must infiltrate an arms dealer's inner circle to bring down his empire of war."
64. Aranmanai 4,2024,MOVIE,2h 28m,5.2,1.7K,NA,"After his sister's suspicious death, a man decides to discover the hidden truth, setting off a chasm for chaos and terror."
65. Jamnapaar,2024–,TV SERIES,NA,8.3,3.1K,NA,"A coming of age journey of Shantanu Bansal aka Shanky from Laxmi Nagar, East Delhi, from disowning his Jamnapaar identity to finally embracing his roots and being proud in the highly competitive backdrop of chartered accountancy life."
66. Bastar: The Naxal Story,2024,MOVIE,2h 4m,6.4,2.9K,NA,Based on the real-life incidents of Naxals in Chattisgarh - The Bastar rebellion broke out in 1910 in present day Chattisgarh.
67. Murder Mubarak,2024,MOVIE,2h 20m,5.9,50K,NA,"During a murder investigation, a non-traditional police officer turns a spotlight on an array of suspects. He steps into their world as an outsider, only to find there is so much more than what meets the eye."
68. Inspector Rishi,2024–,TV SERIES,NA,7.2,2.3K,NA,"A skeptic crime branch Inspector Rishi Nandhan, assisted by two sub-inspectors Ayyanar and Chitra, investigates a series of bizarre murders in a small mountain village, supposedly committed by a deadly forest spirit called the Vanaratchi."
69. TVF Pitchers,2015–2022,TV SERIES,NA,9.1,73K,NA,A story of trials and tribulations of four young entrepreneurs who quit their day jobs in order to pursue their start up venture.
70. Sharmajee Ki Beti,2024,MOVIE,1h 56m,5.5,345,NA,"Multi-generational ensemble about the modern, middle-class female experience and the lives of urban women, all with the common surname of Sharma."
71. Merry Christmas,2024,MOVIE,2h 24m,6.9,27K,NA,Two strangers meet on a fateful Christmas Eve. A night of delirious romance turns into a nightmare. Revealing anything more would be a crime.
72. Mastram,2020,TV SERIES,NA,6.9,2.5K,NA,"Meet Mastram, the quintessential writer of the 80s who spoke the lingo of the Hindi heartland - literally. The 10 episodes feature stories of passion intertwined with turbulent day-to-day scenarios from Mastram's real life."
73. Amar Singh Chamkila,2024,MOVIE,2h 25m,7.9,14K,NA,"Follows the life of pop star duo Amar Singh Chamkila and Amarjot Kaur, whose songs that were social commentaries or devotionals became massive hits in the 80's."
74. Drishyam,2015,MOVIE,2h 43m,8.2,96K,NA,"Desperate measures are taken by a man who tries to save his family from the dark side of the law, after they commit an unexpected crime."
75. Like Stars on Earth,2007,MOVIE,2h 42m,8.3,209K,NA,"An eight-year-old boy is thought to be a lazy trouble-maker, until the new art teacher has the patience and compassion to discover the real problem behind his struggles in school."
76. K.G.F: Chapter 2,2022,MOVIE,2h 46m,8.3,152K,NA,"In the blood-soaked Kolar Gold Fields, Rocky's name strikes fear into his foes, while the government sees him as a threat to law and order. Rocky must battle threats from all sides for unchallenged supremacy."
77. Adipurush,2023,MOVIE,2h 59m,2.7,133K,NA,A modern adaptation of the Indian epic Ramayana which follows the exiled prince Raghav's journey to rescue his wife Janaki from the demon king Lankesh.
78. Drishyam 2,2022,MOVIE,2h 20m,8.2,45K,NA,A gripping tale of an investigation and a family which is threatened by it. Will Vijay Salgaonkar be able to protect his family this time?
79. Anweshippin Kandethum,2024,MOVIE,2h 22m,7.4,7.5K,NA,Revolves around two major crimes that shook kerala and the subsequent inquiry into the cases by sop.
80. Rajni Kaand,2022–,TV SERIES,NA,7.7,306,NA,The story revolves around office colleagues. Amidst work stress they fight and fall in love. Could this change their lives forever?
81. Kohrra,2023–,TV SERIES,NA,7.5,9.3K,NA,"When a bridegroom is found dead days before his wedding, two police officers must unravel the troubling case as turbulence unfolds in their own lives and threatens to ruin the case."
82. Ishq Vishk Rebound,2024,MOVIE,1h 46m,6.9,7K,NA,"Follows the lives of four young people who become enmeshed in a web of friendship, love, and self-discovery."
83. The Hundred-Foot Journey,2014,MOVIE,2h 2m,7.3,88K,55,The Kadam family leaves India for France where they open a restaurant directly across the road from Madame Mallory's Michelin-starred eatery.
84. Hanu Man,2024,MOVIE,2h 38m,7.8,26K,NA,An imaginary place called Anjanadri where the protagonist gets the powers of Hanuman and fights for Anjanadri.
85. Gangs of Wasseypur,2012,MOVIE,5h 21m,8.2,105K,89,"A clash between Sultan and Shahid Khan leads to the expulsion of Khan from Wasseypur, and ignites a deadly blood feud spanning three generations."
86. Savi,2024,MOVIE,2h 6m,8.2,14K,NA,"Savi a simple housewife attempts a daring jailbreak to get her husband out of one of England's high security prisons With 400 inmates, 75 armed guards, 60 surveillance cameras."
87. Blackout,2024,MOVIE,2h 2m,6.6,9.9K,NA,"The streets of Pune, where a single night of darkness engulfs the city in mystery, as crime reporter Lenny, gets entangled in a web of greed and misfortune."
88. All We Imagine as Light,2024,MOVIE,1h 50m,7.1,244,93,"In Mumbai, Nurse Prabha's routine is troubled when she receives an unexpected gift from her estranged husband. Her younger roommate, Anu, tries in vain to find a spot in the city to be intimate with her boyfriend."
89. The Legend of Hanuman,2021–,TV SERIES,NA,9.1,13K,NA,"When the power-hungry Ravan tore through the world to unleash evil, in his way stood a humble vaanar awoken to his divinity to become an immortal legend."
90. Andhadhun,2018,MOVIE,2h 19m,8.2,104K,NA,"A series of mysterious events change the life of a blind pianist, who must now report a crime that he should technically know nothing of."
91. Jai Bhim,2021,MOVIE,2h 44m,8.7,219K,NA,"When a tribal man is arrested for a case of alleged theft, his wife turns to a human-rights lawyer to help bring justice."
92. Made in Heaven,2019–,TV SERIES,NA,8.2,14K,NA,"It is the story of two wedding planners in Delhi, where tradition jostles with modern aspirations against the backdrop of big fat Indian weddings revealing many secrets and lies."
93. Silence 2: The Night Owl Bar Shootout,2024,MOVIE,2h 22m,6.2,1.5K,NA,"ACP Avinash Verma (Manoj Bajpayee) and his SCU are called upon by the Commissioner of Police to investigate a mass shoot-out at the Night Owl Bar in Mumbai. Layers begin to peel at something bigger, deeper, and darker at play."
94. College Romance,2018–2023,TV SERIES,NA,8.3,29K,NA,"Three best friends look for love, laughs and some lifelong memories while attending college together."
95. Dangerous,2022,MOVIE,1h 39m,5.4,1.5K,NA,"Rashmi, an aspiring model, rents an apartment and meets married neighbor Nalini. They fall in love and plot to steal from Nalini's gangster husband. Will the risky con work?"
96. Asur: Welcome to Your Dark Side,2020–,TV SERIES,NA,8.5,66K,NA,"Shubh returns for revenge and this season he takes the challenge to a whole new level. With the heroes fallen apart, will a desolate Dhananjay Rajpoot and a torn Nikhil Nair be able to stop him?"
97. Saaho,2019,MOVIE,2h 50m,5.0,24K,NA,"In a fictional megalopolis, a stunning underworld theft triggers a fierce power struggle among the gangsters, with an enigmatic cop on their trail."
98. Guns & Gulaabs,2023–,TV SERIES,NA,7.7,18K,NA,"In a sleepy town, a mechanic struggles to emerge from his dead gangster father's shadow in a mission to win over the love of his life. An honest officer ends up being a chaos agent; whilst a reluctant cartel heir has an identity crisis."
99. Jaane Jaan,2023,MOVIE,2h 19m,7.0,14K,NA,A single mother and her daughter commit a crime and a neighbor helps them cover it up amid the police investigation.
100. Industry,2024–,TV SERIES,NA,7.0,141,NA,"The roller coaster life of a young struggling writer, who is caught in the politics & turmoil of the inner workings of Bollywood."
101. Swatantrya Veer Savarkar,2024,MOVIE,2h 56m,7.7,16K,NA,"The life journey of Indian freedom fighter and reformer Vinayak Damodar Savarkar, popularly known as Veer Savarkar."
102. Bhakshak,2024,MOVIE,2h 14m,7.2,6.1K,NA,Revolves around the journey of an unwavering woman's quest to seek justice and her perseverance in getting a heinous crime to light.
103. Sajini Shinde Ka Viral Video,2023,MOVIE,1h 56m,6.2,5.7K,NA,"When a school teacher goes missing after a risqué video of her is posted on the internet, a police officer is tasked with uncovering the truth behind her disappearance."
104. Ranneeti: Balakot & Beyond,2024–,TV SERIES,NA,8.2,16K,NA,"Post the deadly Pulwama attacks, Kashyap and his team strike back with a fitting reply. In the age of hybrid warfare, they must race against time to bring back their captured pilot while also battling Pakistan's lies in global media."
105. Pathaan,2023,MOVIE,2h 26m,5.8,157K,47,"An Indian agent races against a doomsday clock as a ruthless mercenary, with a bitter vendetta, mounts an apocalyptic attack against the country."
106. Om Shanti Om,2007,MOVIE,2h 42m,6.8,50K,NA,"In the 1970s, Om, an aspiring actor, is murdered, but is immediately reincarnated into the present day. He attempts to discover the mystery of his demise and find Shanti, the love of his previous life."
107. Mahabharat,2013–2014,TV SERIES,NA,9.0,12K,NA,"The mother of all wars, the epitome of all rivalries, the cauldron of emotions, insecurities, jealousies, and power play - Mahabharat."
108. Undekhi,2020–,TV SERIES,NA,7.9,8.8K,NA,"A dancer is killed in a fit of rage at the wedding of the scion of the Atwal family. A cop comes looking for the girl, while a film crew wants to expose the Atwals for their heinous crime. The Atwals will go to any lengths to remove pawns."
109. Sam Bahadur,2023,MOVIE,2h 30m,7.7,17K,NA,Revolves around the high and low points of Sam Manekshaw who became the first Indian Army officer to be promoted to the rank of Field Marshal.
110. My Name Is Khan,2010,MOVIE,2h 45m,7.9,117K,50,"Rizwan Khan is a Muslim immigrant to the US with Asperger's syndrome. After his family falls apart in the aftermath of 9/11, he begins an epic quest across the country to speak to the President of the United States and clear his name."
111. Hasratein,2022,TV SERIES,NA,5.1,112,NA,An anthology which traces the lives of five real women who break the shackles of a male chauvinistic taboo to explore their sexuality and desire.
112. Scam 2003 - The Telgi Story,2023,TV SERIES,NA,7.9,7.6K,NA,"Born in Khanapur in Karnataka, Telgi became the mastermind behind one of the most ingenious schemes in Indian history that spread across multiple states and shook the entire country."
113. Yodha,2024,MOVIE,2h 10m,5.7,7.9K,NA,"After terrorists hijack a passenger plane, an off-duty soldier aboard devises a strategy to defeat the hijackers and ensure the passengers' survival when the engine fails."
114. Mr. & Mrs. Mahi,2024,MOVIE,2h 19m,6.5,13K,NA,A married couple who share a love for cricket begin training in the game due to her natural talent.
115. Maamla Legal Hai,2024–,TV SERIES,NA,8.0,8.8K,NA,"Chaos collides with the letter of the law at District Court Patparganj, where quirky employees work to uphold justice but not without a few objections."
116. Lagaan: Once Upon a Time in India,2001,MOVIE,3h 44m,8.1,121K,84,The people of a small village in Victorian India stake their future on a game of cricket against their ruthless British rulers.
117. Your Honor,2020–,TV SERIES,NA,7.2,3.1K,NA,"As the son of a reputed judge gets involved in a hit and run, we see how even the most upright people break In order to save their family. The judge sacrifices relationships and subverts the law to save his son from a vengeful gangster."
118. Sultan,2016,MOVIE,2h 50m,7.1,52K,NA,"Sultan is a classic underdog tale about a wrestler's journey, looking for a comeback by defeating all odds."
119. Sita Ramam,2022,MOVIE,2h 43m,8.5,70K,NA,"An orphan soldier, Lieutenant Ram's life changes, after he gets a letter from a girl named Sita. He meets her and love blossoms between them. When he comes back to his camp in Kashmir,After he gets caught in jail, he sends a letter to Sita which won't reach her."
120. Hamare Baarah,2024,MOVIE,2h 28m,7.4,1.5K,NA,"A woman takes her father to court to allow her mother, who is in the midst of a risky pregnancy, the right to terminate the pregnancy in order to save her life."
121. Freddy,2022,MOVIE,2h 4m,7.3,34K,NA,The lines between love and obsession blur in this romantic thriller packed with unpredictable twists and sharp turns.
