Title,Year Released,Media Type,Movie Duration,Audience Rating,Audience Vote Count,Metacritic Score,Plot Description
367. The Trial,2023–,TV SERIES,NA,5.4,1.6K,NA,A housewife is forced to take full responsibility of her family after her husband is imprisoned over a corruption and sex scandal.
368. All That Breathes,2022,MOVIE,1h 37m,7.0,4.9K,87,"Amidst the darkening backdrop of Delhi's apocalyptic air and escalating violence, two brothers devote their lives to protect one casualty of the turbulent times: the bird known as the Black Kite."
369. Four More Shots Please,2019–2022,TV SERIES,NA,5.7,55K,NA,"Four female friends from different walks of life deal with romance, work-life conflicts, ambitions and anxieties in modern-day India."
370. P.I. Meena,2023–,TV SERIES,NA,6.0,3.8K,NA,"A young, troubled, female private investigator gets thrown into a world, where she has to fathom the unfathomable and find her own self."
371. Udta Punjab,2016,MOVIE,2h 28m,7.7,32K,NA,A story that revolves around drug abuse in the affluent north Indian State of Punjab and how the youth there have succumbed to it en-masse resulting in a socio-economic decline.
372. Darr,1993,MOVIE,2h 58m,7.6,26K,NA,"Rahul is obsessed with Kiran and stalks her constantly. However, Rahul goes berserk when she gets engaged to Sunil, a navy officer, and he decides to forcefully claim Kiran for himself."
373. Gunday,2014,MOVIE,2h 32m,2.7,60K,NA,"The lives of Calcutta's most powerful Gunday, Bikram and Bala, changes when Nandita enters it. Then a counter-force takes charge and a thriller unfolds."
374. Singham,2011,MOVIE,2h 23m,6.8,19K,NA,A truly honest police officer is transferred to a town controlled by a gangster he has humiliated. The gangster believes he can use good power to bring down this officer who made him look foolish and weak.
375. Tamasha,2015,MOVIE,2h 19m,7.4,32K,NA,"A boy meets a girl, in Corsica. They decide not to reveal their real name or personality."
376. Desi Boyz,2011,MOVIE,2h 2m,5.7,15K,NA,"Two friends lose their jobs, then part bitterly after they get exposed as male strippers."
377. Omkara,2006,MOVIE,2h 35m,8.0,22K,NA,A politically-minded enforcer's misguided trust in his lieutenant leads him to suspect his wife of infidelity in this adaptation of Shakespeare's 'Othello'.
378. Sanam Teri Kasam,2016,MOVIE,2h 34m,7.6,17K,NA,"After being disowned by her family, an awkward librarian relies on the help of her brooding neighbour."
379. Permanent Roommates,2014–2023,TV SERIES,NA,8.6,26K,NA,"A couple, who were in a long distance relationship for 3 years, face the prospect of getting married."
380. Kahaani Ghar Ghar Kii,2000–2008,TV SERIES,NA,2.3,845,NA,"The show explored the worlds of its protagonists Parvati Aggarwal and Om Aggarwal, who live in a joint family where by Parvati is an ideal daughter-in-law of Aggarwal family and Om the ideal son."
381. Tehran,2024,MOVIE,NA,NA,NA,NA,NA
382. Tadap,2021,MOVIE,2h 6m,5.1,4.8K,NA,Unforeseen circumstances threaten the passionate relationship between star-crossed lovers.
383. Mumbai Diaries,2021–,TV SERIES,NA,8.6,31K,NA,"Set during the 2008 Mumbai attacks, it follows the staff of Bombay General Hospital and their travails during the fateful night of November 26, 2008."
384. Khel Khel Mein,2024,MOVIE,NA,NA,NA,NA,The story revolves around a group of friends who gather for a dinner and end up revealing secrets about each other. Khel Khel Mein is the official remake of 2016's Italian comedy thriller film 'Perfect Strangers'
385. The Villain,2014,MOVIE,2h 9m,6.6,23K,NA,"When his wife becomes the latest victim of a serial killer, Guru blurs the line between good and evil in his pursuit of revenge."
386. Dange,2024,MOVIE,2h 34m,5.4,643,NA,"Journey that delves deep into the complexities of friends. Set against the backdrop of a vibrant college festival, the movie explores the intricate dynamics between two friends whose paths diverge and ignite a fierce competition."
387. Rahasya,2015,MOVIE,2h 3m,7.6,5.6K,NA,"A Doctor stands accused of killing his own eighteen-year old daughter. While this aggrieved father protests his innocence, all evidence points towards him irrefutably."
388. Duranga,2022–2023,TV SERIES,NA,7.4,3.2K,NA,"Sammit is the ideal family man. What happens when his wife, inspector Ira's investigation into a series of murders leads her to him? Has Sammit been living the perfect life or the perfect lie?"
389. Sangharsh,1999,MOVIE,2h 7m,6.7,5.8K,NA,"A rookie CBI officer must enlist the help of an incarcerated criminal in order to catch a serial child killer, who has recently escaped police custody."
390. Yeh Kaali Kaali Ankhein,2022–,TV SERIES,NA,7.0,9K,NA,"Aggressively pursued by a politician's daughter who will do anything to marry him, a small-town man takes drastic measures to reclaim his life."
391. M.S. Dhoni: The Untold Story,2016,MOVIE,3h 4m,8.0,69K,NA,The untold story of Mahendra Singh Dhoni's journey from ticket collector to trophy collector - the world-cup-winning captain of the Indian Cricket Team.
392. Bawaal,2023,MOVIE,2h 17m,6.6,16K,NA,A small-town man who falls in love with the most beautiful girl in town. He wants to marry her one day because marrying her can raise his social position.
393. Amber Girls School,2024–,TV SERIES,NA,6.5,808,NA,"Ojas, a 15-year-old, student of 9th grade chases her dream to be the Head Girl. This puts her in direct conflict with her desire to explore all things teenage. Will she pursue her Head Girl dream or find her voice through this journey?"
394. Kannur Squad,2023,MOVIE,2h 41m,7.6,8.8K,NA,"The gripping saga of a police officer and his team, their challenging journey to nab a criminal gang across the country. Further, it shows how he leads his team towards triumph, amidst professional uncertainties in this gripping drama."
395. Sonu Ke Titu Ki Sweety,2018,MOVIE,2h 18m,7.1,25K,NA,Titu is going to marry a perfect woman named Sweety. Titu's best-friend Sonu doubts Sweety's character and tries to break the marriage while Sweety tries to do opposite and which leads to war between Bromance and Romance.
396. Gulaal,2009,MOVIE,2h 20m,8.0,16K,NA,"A law student witnesses deception, homicide, and crime after being elected as General Secretary of his college."
397. Sooryavanshi,2021,MOVIE,2h 25m,5.9,79K,NA,"DCP Veer Sooryavanshi, the chief of the Anti-Terrorism Squad in India, tries to bring down a terrorist organization with which he has a history."
398. Satya,1998,MOVIE,2h 50m,8.3,17K,NA,An innocent man is embroiled in underworld after being falsely charged and sets out to punish the perpetrators who subjected his life to misery.
399. Tere Ishq Mein Ghayal,2023,TV SERIES,NA,5.1,1.2K,NA,"Isha is in love with Armaan but they are drawn apart when Veer, his brother enters the picture. Explore a world of love and secrets as the young girl deals with the siblings, who belong to a supernatural species."
400. Fukrey,2013,MOVIE,2h 19m,6.9,13K,NA,"The paths of four dream-chasing college friends cross with an array of colourful characters, from a tough-talking Punjabi female don to a Jugaad Baaz college watchman. Mayhem ensues."
401. Dil Bechara,2020,MOVIE,1h 41m,8.3,135K,NA,"The emotional journey of two hopelessly-in-love youngsters; a young girl, Kizie, who is suffering from cancer; and Manny, a boy Kizie meets at a support group."
402. Mujhse Dosti Karoge!,2002,MOVIE,2h 29m,5.1,6.3K,NA,"Meet Raj, Pooja and Tina - 3 best friends thrown into a situation that time, letters, love and separation have created for them."
403. The Sky Is Pink,2019,MOVIE,2h 23m,7.6,9.9K,55,"Based on the love story of a couple spanning 25 years and told through the lens of their spunky teenage daughter Aisha Chaudhary, who was diagnosed with pulmonary fibrosis."
404. Taarak Mehta Ka Ooltah Chashmah,2008–,TV SERIES,NA,8.2,13K,NA,"The day-to-day happenings of Gokuldham Society and its members, who live, celebrate and often face problems together."
405. Kabhi Alvida Naa Kehna,2006,MOVIE,3h 13m,6.1,22K,NA,"Dev, a former football player is married to Rhea, a successful fashion editor. Maya is a kindergarten teacher who is married to Rishi, an outgoing event planner. These couples' lives intersect and they each question their own marriage."
406. Bhoomi,2017,MOVIE,2h 16m,5.3,2K,NA,A single father battles injustice after his daughter is raped and the perpetrators are found not guilty.
407. Don,2006,MOVIE,2h 51m,7.1,41K,NA,"Vijay is recruited by a police officer to masquerade as his lookalike Don, the leader of an international gang of smugglers. Things go wrong when the officer is killed and Vijay is left to fend for himself."
408. Ae Dil Hai Mushkil,2016,MOVIE,2h 38m,5.8,26K,40,"This story explores love - the shapes it takes, the ways it changes us and the exhilarating and often terrifying ride it takes us on. It is the journey of two characters, Alizeh and Ayan, as they navigate life, love and heartbreak."
409. Kapoor & Sons,2016,MOVIE,2h 12m,7.7,29K,NA,The story about two brothers who visit their dysfunctional family for their grandfather's birthday party.
410. Malang,2020,MOVIE,2h 15m,6.5,12K,NA,"Advait visits Goa where he meets Sara, a free-spirited girl who lives life unshackled. Opposites attract and all goes well until life turns upside down. Years later, Advait is on a killing spree with cops Aghase and Michael in his way."
411. Dil Se..,1998,MOVIE,2h 43m,7.5,31K,NA,A radio broadcaster's intense attraction to a mysterious woman opens the door to a tidal wave of powerful emotions and desires.
412. Mom,2017,MOVIE,2h 26m,7.2,12K,NA,"After her daughter is sexually assaulted at a party, a furious mother sets out to destroy the lives of the four perpetrators who walked away free."
413. Dedh Bigha Zameen,2024,MOVIE,1h 40m,7.0,578,NA,"Anil sells his land for his sister's wedding, but a powerful official steals it. He fights for justice, facing threats and betrayal."
414. Dhoom,2004,MOVIE,2h 9m,6.6,23K,NA,"Dhoom reinvents the classic cops and robbers tale for the 21st century. Fast bikes, big action, and non-stop fun make for a thrilling story."
415. Student of the Year 2,2019,MOVIE,2h 26m,2.2,23K,NA,"A student must face off against bullies and overcome hurdles, both academic and romantic, to win his college's coveted Student of the Year trophy."
416. Baaghi 3,2020,MOVIE,2h 23m,2.2,14K,NA,A man embarks on a bloody rampage to save his kidnapped brother.
417. Prahaar: The Final Attack,1991,MOVIE,2h 31m,8.0,2.2K,NA,"Prahaar is the story of Major Chauhan, a tough and stern soldier, trained to destroy the enemy. He can see the enemy on our borders but is unaware of the invisible enemy within ourselves. When one of Major's Commandos - Peter D'Souza is killed, he is shown the harsh reality revolving around us, the enemy is within ourselves. The battlefield changes and Major Chavan makes his final attack on the enemy within this crumbling society."
418. Highway,2014,MOVIE,2h 13m,7.6,31K,40,"Right before her wedding, a young woman finds herself abducted and held for ransom. As the initial days pass, she begins to develop a strange bond with her kidnapper."
419. Criminal Justice: Adhura Sach,2022–,TV SERIES,NA,7.7,6.6K,NA,Madhav Mishra is back to fight his toughest case yet nothing is simple and straightforward. Will justice win?
420. Dil Dhadakne Do,2015,MOVIE,2h 50m,7.0,20K,NA,The Mehra family must contemplate over their way of living and their love lives while on a cruise celebrating their 30th wedding anniversary.
421. Kahaani,2012,MOVIE,2h 2m,8.1,66K,NA,"A pregnant woman's search for her missing husband takes her from London to Kolkata, but everyone she questions denies having ever met him."
422. Race,2008,MOVIE,2h 29m,6.7,16K,NA,Destiny makes two brothers- Ranvir and Rajiv - enemies of each other. Everything is fair in love and war.
423. Mrs. Serial Killer,2020,MOVIE,1h 46m,4.0,19K,NA,"When a doctor gets jailed for a string of shocking murders, his loyal wife sets out to commit a copycat crime to prove his innocence."
424. Pyaar Ka Punchnama 2,2015,MOVIE,2h 17m,7.3,16K,NA,"After falling in love, three roommates experience changes in their lives."
425. Dil To Pagal Hai,1997,MOVIE,3h,7.0,25K,NA,"A grand musical about three passionate and dreamy characters: Rahul, Pooja and Nisha. Will their dreams come true? Will they find their true love?"
426. Sindoor Ki Keemat,2021–2023,TV SERIES,NA,7.5,101,NA,NA
427. Kadak Singh,2023,MOVIE,2h 8m,6.3,5.8K,NA,AK Srivastava an officer of the Department of Financial Crimes is diagnosed with retrograde amnesia despite which he solves the case of a Chit Fund Scam by listening to different perspectives of who he was and how he came to the hospital.
428. Typewriter,2019,TV SERIES,NA,6.5,4.3K,NA,"Three young friends in Goa plan to search an old villa for ghosts, but when a new family moves in, the home's buried past resurfaces in chilling ways."
429. Tiger Zinda Hai,2017,MOVIE,2h 41m,5.9,34K,NA,RAW Agent Tiger joins forces with Zoya in order to rescue a group of nurses who are held hostage by a terrorist organisation.
430. Sexy Ghotala,2023–,TV SERIES,NA,9.0,32,NA,"An anthology series about love, greed, longing, jealousy, gender politics that are set amidst backdrops of different eras. Every episode will leave you on the edge of your seat as you unravel the darkest crime and deepest confessions."
431. Jab Tak Hai Jaan,2012,MOVIE,2h 56m,6.7,59K,NA,An uncompromising film on true love from the legendary and unforgettable director Yash Chopra which is fascinatingly distinctive and contemporary.
432. Dhoomam,2023,MOVIE,2h 23m,5.6,963,NA,"Avinash wants to quit his marketing job at a top cigarette company, but it comes with consequences."
433. Pehredaar,2022–,TV SERIES,NA,7.8,73,NA,A village culture where the father-in-law also marries his daughter-in-law. So that he can take care of his daughter-in-law in the absence of his son.
434. Aalavandhan,2001,MOVIE,2h 57m,7.2,3K,NA,"Nandu and Vijay are brothers, who were abused by their stepmother during their younger days. Nandhu, who is mentally ill, decides to kill Vijay's fiancee as he visualizes her as his stepmother."
435. Double Ismart,2024,MOVIE,2h 36m,NA,NA,NA,"When a dead police officer's memories are transplanted to his brain, an assassin assists the authorities."
436. Ramayana: The Legend of Prince Rama,1993,MOVIE,2h 15m,9.2,15K,NA,"An anime adaptation of the Hindu epic the Ramayana, where Lord Ram combats the wicked king Ravana."
437. Nayi Naveli,2021–,TV SERIES,NA,5.2,118,NA,The plot revolves around the life of two happy couple. Small issues bring them under stress. Their relationship gets affected due to the challenges. Can they find a solution to solve the issue?
438. Vettaiyan,2024,MOVIE,NA,NA,NA,NA,Follows a retired police officer as he fights against the system.
439. Raazi,2018,MOVIE,2h 18m,7.7,34K,NA,A Kashmiri woman agrees to marry a Pakistani army officer in order to spy on Pakistan during the Indo-Pakistan War of 1971.
440. 13B: Fear Has a New Address,2009,MOVIE,2h 26m,7.3,8.7K,NA,"A man experiences a supernatural occurrence at his newly purchased apartment; a soap opera being telecast exclusively on his TV, which shows the future of his family."
441. Mangalavaaram,2023,MOVIE,2h 29m,6.7,2.4K,NA,"Fear engulfs a village as murders pile up mysteriously. Shailu, a young woman is the heart of the story and the enigmatic tale unravels with a suspenseful cinematic journey."
442. Rangbaaz,2018–2022,TV SERIES,NA,7.8,5.6K,NA,Rangbaaz Phir Se is inspired from the life of Anandpal Singh who was a gangster active in the state of Rajasthan. The series chronicles his rise to becoming the most wanted criminal in the history of Rajasthan.
443. Label,2023–,TV SERIES,NA,7.3,3.5K,NA,"Revolves around the protagonist struggle to reach his desired identity, overcoming the identity society has labelled him with."
444. Jo Jeeta Wohi Sikandar,1992,MOVIE,2h 54m,8.1,24K,NA,"A rich brat and a poor chap try to woo a girl, with their rivalry culminating in the most prestigious college event - the marathon cycle race."
445. Murder,2004,MOVIE,2h 10m,5.5,4.4K,NA,"Unhappy with her marriage with workaholic man, a woman finds solace in her lover and starts a steamy affair. But this fills her with guilt and leaves him, but he is determined to get her - at any cost."
446. Inside Edge,2017–,TV SERIES,NA,7.9,13K,NA,"Inside Edge is the story of the Mumbai Mavericks, a T20 cricket franchise playing in the Powerplay League. Set in a landscape of conflicting interests, where selfishness is almost a virtue, where sex, money, and power are mere means to an end, Inside Edge is a story that pulls no punches, minces no words, and takes no prisoners. Come witness the game behind the game."
447. Dostana,2008,MOVIE,2h 25m,6.4,16K,NA,"Two straight guys pretend to be gay in order to secure a Miami apartment. When both of them fall for their roommate Neha, hilarity ensues as they strive to convince one and all that they're gay whilst secretly trying to win her heart."
448. Street Dancer 3D,2020,MOVIE,2h 26m,3.7,8.3K,NA,"Two rival dance groups from India and Pakistan who are always competing against each other, join forces when it comes to competing at an international dance competition."
449. Abhay,2019–,TV SERIES,NA,8.0,13K,NA,"Abhay Pratap Singh, the gutsy cop who can outwit any criminal, is back. Only this time, he is up against some sharper and hardened evil masterminds. Join him as he sets out on the road to justice with a darker and edgier."
450. Suzhal - The Vortex,2022–,TV SERIES,NA,8.2,9.4K,NA,"In a small South Indian town, a seemingly routine minor case explodes into a twisted crime thriller that rips apart its social fabric."
451. Yes Mam,2023–,TV SERIES,NA,8.3,42,NA,NA
452. Pagglait,2021,MOVIE,1h 54m,6.9,10K,NA,"Widowed soon after marriage, a young woman grapples with an inability to grieve, quirky relatives, and a startling discovery about her late husband."
453. Silence: Can You Hear It,2021,MOVIE,2h 16m,6.5,5.6K,NA,"When everyone is hiding the truth, justice will thrive despite the silence. Prepare for a murder mystery that will keep you guessing till the end."
454. The Great Indian Murder,2022–,TV SERIES,NA,6.7,14K,NA,"When notorious industrialist Vicky Rai gets killed at a party, the main suspects are the guests - both invited and uninvited."
455. Amar Akbar Anthony,1977,MOVIE,3h 4m,7.4,8.3K,NA,"Three brothers are separated and united after many years - one is brought up a Hindu, another a Muslim and the last (and most memorable) a Christian. Hilarity and adventure ensues."
456. Antim: The Final Truth,2021,MOVIE,2h 18m,6.2,42K,NA,The cop played by Salman fights the land mafia in the film.
457. Thar,2022,MOVIE,1h 48m,6.1,8K,NA,A mysterious stranger arrives in a village situated in the Thar desert and crosses paths with a veteran cop investigating a case of brutal killings.
458. Operation Valentine,2024,MOVIE,2h 13m,5.3,997,NA,"Showcasing the indomitable spirits of the Indian Air Force heroes on the frontlines and the challenges they face during one of the biggest, fiercest aerial attacks that India has ever seen."
459. XXX: Uncensored,2018–2020,TV SERIES,NA,4.7,797,NA,"An erotic anthology series exploring different aspects of love, lust and romance."
460. Bhagam Bhag,2006,MOVIE,2h 37m,6.6,15K,NA,"The members of a drama troupe fall in trouble when they are framed for a murder. Things go worse when they find their actress committing suicide, which is somehow linked with the murder."
461. Eclipse,2021–,TV SERIES,NA,8.3,7.9K,NA,It's 1984 - a tender love story succumbs to the anti-Sikh riots. It's 2016 - IPS officer Amrita Singh uncovers a secret connecting that past to her present.
462. Yaariyan 2,2023,MOVIE,2h 28m,5.1,11K,NA,"After moving to Mumbai, three cousins experience difficulties in their romantic relationships."
463. Parking,2023,MOVIE,2h 7m,7.8,11K,NA,An elderly man and a youngster who are tenants sharing two different floors of an individual house fight over a parking space.
464. Any Body Can Dance 2,2015,MOVIE,2h 34m,5.4,7.2K,NA,"Based on the true story of the Fictitious Dance group; their rise to fame, sudden downfall, and their heroic attempt to seek vindication by regaining their lost pride and glory."
465. Baadshah,1999,MOVIE,2h 55m,6.8,20K,NA,A small time detective is mistaken as a CBI agent and gets embroiled in a deadly mission to save the Chief Minister from an assassination attempt.
466. Chamak,2023–,TV SERIES,NA,7.2,54K,NA,"Kaala - an aspirational rapper from Canada who flees back to Punjab, learns about the mysterious murder of his father and iconic singer Taara Singh. The story unfolds the dark side of music industry's glamour, politics and more."
467. Martin,2024,MOVIE,NA,NA,NA,NA,"A journey of a man discovering himself, finding love and fighting for his motherland. Can he hold the fort on all three gates?"
468. Dear Zindagi,2016,MOVIE,2h 31m,7.4,44K,NA,"Kaira is a budding cinematographer in search of a perfect life. Her encounter with Jug, an unconventional thinker, helps her gain a new perspective on life. She discovers that happiness is all about finding comfort in life's imperfections."
469. Udaan,2010,MOVIE,2h 14m,8.1,48K,NA,"Expelled from his school, a 16-year old boy returns home to his abusive and oppressive father."
470. Climax,2020,MOVIE,52m,2.1,378,NA,"Mia and her boyfriend, ignore warnings and venture into a desert, facing treacherous situations. Their search for safety in a town fails as more perils emerge. Their ordeal focuses on uncovering the mastermind and surviving."
471. A Death in the Gunj,2016,MOVIE,1h 50m,7.4,6.3K,NA,Life for a shy young Indian student slowly falls to pieces during a family road trip.
472. Baghban,2003,MOVIE,3h 1m,7.4,18K,NA,"An elderly couple wish their children to care for them in their old age. But their children see and treat them as a burden, and they must struggle to regain their worth and dignity to themselves and others."
473. Main Atal Hoon,2024,MOVIE,2h 19m,7.0,5.8K,NA,"Follows the extraordinary life and political journey of Shri Atal Bihari Vajpayee, an iconic figure in Indian politics and delves into the multifaceted persona of Vajpayee Ji, capturing his essence as a poet, a gentleman, and a statesman."
474. Razakar: The Silent Genocide of Hyderabad,2024,MOVIE,2h 46m,8.0,4.8K,NA,Revolves around the Hyderabad Liberation Movement of 1948. Capture the struggles of Telangana and its people in the early days of Independence to reclaim their religion and identity in the face of military and political oppression.
475. Super 30,2019,MOVIE,2h 34m,7.9,37K,NA,Based on the life of Patna-based mathematician Anand Kumar who runs the famed Super 30 program for IIT aspirants in Patna.
476. Ra.One,2011,MOVIE,2h 36m,4.8,47K,60,"When the titular antagonist of an action game takes on physical form, it's only the game's less powerful protagonist who can save his creator's family."
477. Shahid,2012,MOVIE,2h 9m,8.2,18K,NA,"The account of Human Rights lawyer Shahid Azmi, an ordinary citizen with an extraordinary commitment to justice."
478. Half CA,2023–,TV SERIES,NA,8.4,3.5K,NA,"Two CA Aspirants from two different ends of the spectrum of the course, Archie and Niraj embark on the journey of one of the toughest courses and face the obstacles it has to offer."
479. CC2C,2009,MOVIE,2h 34m,4.3,9.5K,44,A cook from Chandni Chowk gets mistaken for the reincarnation of an ancient peasant warrior by the residents of an oppressed Chinese village.
480. All Ladies Do It,2020,MOVIE,1h 37m,5.9,474,NA,A Handsome young man gets erotically involved with a Sultry seductive wife of an impotent man only to find himself tangles in a dangerous web of lies and cheat.
481. Iss Pyaar Ko Kya Naam Doon,2011–2018,TV SERIES,NA,7.6,4.3K,NA,"Arnav, a wealthy business tycoon, decides to ruin Khushi's reputation after he thinks she sabotaged one of his events. Meanwhile, Khushi quietly suffers for the crimes she didn't commit."
482. Runway 34,2022,MOVIE,2h 25m,7.0,30K,NA,"Inspired by true incidents, ""Runway 34"" revolves around Captain Vikrant Khanna played by Ajay Devgn, a flying prodigy, whose flight takes a mysterious course after take-off from an international destination."
483. Heropanti,2014,MOVIE,2h 26m,5.2,11K,NA,Two young people find love despite the violent landscape in which they live.
484. Ramayan,1987–1988,TV SERIES,NA,9.0,24K,NA,"An adaptation of the ancient epic in which the exiled Prince Rama and his brother Laxman set out to save Rama's wife, Sita, who has been kidnapped by the demon king of Lanka Ravana."
485. Rang De Basanti,2006,MOVIE,2h 47m,8.1,123K,NA,"The story of six young Indians who assist an English woman to film a documentary on the freedom fighters from their past, and the events that lead them to relive the long-forgotten saga of freedom."
486. Ittefaq,2017,MOVIE,1h 45m,7.2,15K,NA,A detective seeks out the truth between two different stories of a crime scene.
487. Raaz 3,2012,MOVIE,2h 19m,4.2,4.1K,NA,"When an ingénue's sudden popularity threatens to shove her out of the spotlight, a movie star uses black magic in an attempt to derail her career."
488. Tabbar,2021–,TV SERIES,NA,8.2,4.7K,NA,The show charts the journey of a retired police constable who pushes the boundaries to save his family from the consequences of an unfortunate incident.
489. Hamari Adhuri Kahani,2015,MOVIE,2h 9m,6.7,6.9K,NA,"A single mother finds solace with a wealthy, but lonely hotel magnate, together they find love until her past comes back to confront her."
490. Salaam Venky,2022,MOVIE,2h 17m,6.6,2.2K,NA,"Sujata, an ideal mother, who battled the most challenging situations one can ever face with a smile."
491. Kennedy,2023,MOVIE,2h 22m,6.2,236,NA,"An insomniac ex-cop who dwells in different circumstances looking for redemption. The ex-cop, who is presumed dead for a long time, operates secretly for the corrupt system."
